Name,FirstName,LastName,Affiliation,Location,Role,Country,OrcID
Yi Lu (MIT),Yi,Lu,Massachusetts Institute of Technology,CSAIL,Member Review Board,United States,
Yikai Zhang (Chinese University of Hong Kong),Yikai,Zhang,Chinese University of Hong Kong,Hong Kong,Member Review Board,China,
Ying Zhang (University of Technology Sydney),Ying,Zhang,University of Technology Sydney,Sydney,Member Review Board,Australia,
Yongxin Tong (Beihang University),Yongxin,Tong,Beihang University,Beijing,Member Review Board,China,https://orcid.org/0000-0002-5598-0312
Yuanyuan Zhu (Wuhan University),Yuanyuan,Zhu,Wuhan University,Wuhan,Member Review Board,China,
"Yue Wang (Shenzhen Institute of Computing Sciences, Shenzhen University)",Yue,Wang,Shenzhen University,Shenzhen,Member Review Board,China,
Yufei Tao (Chinese University of Hong Kong),Yufei,Tao,Chinese University of Hong Kong,Hong Kong,Member Review Board,China,https://orcid.org/0000-0003-3883-5452
Yuliang Li (Megagon Labs),Yuliang,Li,Megagon Labs,Mountain View,Member Review Board,United States,
Yuncheng Wu (National University of Singapore),Yuncheng,Wu,National University of Singapore,Singapore,Member Review Board,Singapore,https://orcid.org/0000-0002-1436-3916
Yunjun Gao (Zhejiang University),Yunjun,Gao,Zhejiang University,Zhejiang,Member Review Board,China,https://orcid.org/0000-0003-3816-8450
Yuval Moskovitch (University of Michigan),Yuval,Moskovitch,University of Michigan,Ann Arbor,Member Review Board,United States,
Zhifeng Bao (RMIT University),Zhifeng,Bao,RMIT University,Melbourne,Member Review Board,Australia,https://orcid.org/0000-0003-2477-381X
Zhongle Xie,Zhongle,Xie,National University of Singapore,Singapore,Member Review Board,Singapore,
Zi Huang (University of Queensland),Zi,Huang,University of Queensland,Brisbane,Member Review Board,Australia,
Ziawasch Abedjan (Hannover),Ziawasch,Abedjan,University of Hanover,Hanover,Member Review Board,Germany,
